{
  "$schema": "https://json-schema.org/draft/2020-12/schema",
  "title": "CEP Technology Pack v1",
  "description": "Declarative project recipes. CEP validation additionally rejects unsafe paths, shell wrappers and duplicate identifiers. Format validation never grants execution rights.",
  "type": "object",
  "additionalProperties": false,
  "required": [
    "schema_version",
    "id",
    "version",
    "description",
    "detect",
    "toolchains",
    "commands",
    "roles",
    "required_capabilities"
  ],
  "properties": {
    "schema_version": {
      "const": 1,
      "type": "integer"
    },
    "id": {
      "type": "string",
      "pattern": "^[a-z][a-z0-9_-]{0,63}$"
    },
    "version": {
      "type": "string",
      "pattern": "^[0-9]+\\.[0-9]+\\.[0-9]+(?:-[a-zA-Z0-9.-]+)?$"
    },
    "description": {
      "type": "string",
      "minLength": 1
    },
    "detect": {
      "type": "object",
      "additionalProperties": false,
      "required": [
        "any_files"
      ],
      "properties": {
        "any_files": {
          "type": "array",
          "items": {
            "type": "string",
            "minLength": 1
          },
          "uniqueItems": true,
          "minItems": 1
        }
      }
    },
    "toolchains": {
      "type": "array",
      "minItems": 1,
      "items": {
        "type": "object",
        "additionalProperties": false,
        "required": [
          "name",
          "version_command",
          "version_constraint"
        ],
        "properties": {
          "name": {
            "type": "string",
            "pattern": "^[a-z][a-z0-9_-]{0,63}$"
          },
          "version_command": {
            "type": "array",
            "minItems": 1,
            "items": {
              "type": "string",
              "minLength": 1
            }
          },
          "version_constraint": {
            "type": "string",
            "minLength": 1
          }
        }
      }
    },
    "commands": {
      "type": "array",
      "minItems": 1,
      "items": {
        "type": "object",
        "additionalProperties": false,
        "required": [
          "id",
          "action",
          "argv",
          "cwd",
          "timeout_seconds",
          "required"
        ],
        "properties": {
          "id": {
            "type": "string",
            "pattern": "^[a-z][a-z0-9_-]{0,63}$"
          },
          "action": {
            "enum": [
              "test",
              "lint",
              "typecheck",
              "build",
              "security",
              "format-check"
            ]
          },
          "argv": {
            "type": "array",
            "minItems": 1,
            "items": {
              "type": "string",
              "minLength": 1
            }
          },
          "cwd": {
            "type": "string",
            "minLength": 1
          },
          "timeout_seconds": {
            "type": "integer",
            "minimum": 1,
            "maximum": 3600
          },
          "required": {
            "type": "boolean"
          }
        }
      }
    },
    "roles": {
      "type": "array",
      "items": {
        "type": "string",
        "pattern": "^[a-z][a-z0-9_-]{0,63}$"
      },
      "uniqueItems": true
    },
    "required_capabilities": {
      "type": "array",
      "items": {
        "type": "string",
        "pattern": "^[a-z][a-z0-9_.:-]{0,127}$"
      },
      "uniqueItems": true
    }
  }
}
